partai,kalimat,kata0,kata1,kata2,kata3,kata4,kategori
Demokrat,juang aspirasi rakyat aceh indonesia  ,juang,bidang,bangun,masyarakat,masyarakat,Pembangunan Daerah
Nasdem,juang hak hak kaum perempuan  ,juang,bangun,masyarakat,masyarakat,masyarakat,Pembangunan Daerah
Gerindra,juang hak hak perempuan bangun aceh  ,juang,bidang,bangun,masyarakat,utara,Pembangunan Daerah
Golkar,juang aspirasi rakyat aceh indonesia  ,juang,bidang,bangun,masyarakat,utara,Pembangunan Daerah
PKS,1 juang program aksi gerindra tingkat sehat masyarakat   ,juang,bidang,bangun,masyarakat,utara,Pembangunan Daerah
PPP,1 juang misi pks   ,juang,bidang,bangun,masyarakat,utara,Pembangunan Daerah
PKB,juang wujud masyarakat cerdas   ,juang,bidang,bangun,masyarakat,utara,Pembangunan Daerah
PSI,juang sejahtera buruh kerja keluarga  ,juang,bidang,bangun,masyarakat,utara,Pembangunan Daerah
PAN,a dorong tinjau ulang amandemen uud cita cita juang merdeka  ,juang,bidang,bangun,masyarakat,utara,Pembangunan Daerah
PKPI,juang disparitas ekonomi kabupaten cianjur utara selatan tara dapat juang tingkat didik kabupataen cianjur bawah standar rata2 nasional juang peuang kerja kabupaten cianjur kota bogor   ,juang,bidang,bangun,masyarakat,utara,Pembangunan Daerah
Garuda,juang hak hak perempuan   ,juang,bidang,masyarakat,utara,utara,Pembangunan Daerah
Hanura,juang kaum perempuan daya mandiri  ,juang,bidang,bangun,masyarakat,utara,Pembangunan Daerah
Berkarya,a dorong tinjau ulang amandemen uud cita cita juang merdeka  ,juang,bidang,bangun,masyarakat,utara,Pembangunan Daerah
PDIP,juang aspirasi perempuan anak   ,juang,bidang,bangun,masyarakat,utara,Pembangunan Daerah
PBB,juang sejahtera masyarakat   ,juang,bidang,bangun,masyarakat,masyarakat,Pembangunan Daerah
Gerindra,lanjut  didik  bas  dayah  bantu  masyarakat  tengah                                              ,masyarakat,tingkat,pihak,perintah,perintah,Pergerakan Nasional
Berkarya,bantu  masyarakat  kalang                                                  ,masyarakat,hak,tingkat,perintah,perintah,Pergerakan Nasional
PKS,1  wujud  bangun  dampak  nyata  sejahtera  masyarakat  aceh  fungsi  anggar  cermat  sasar                                         ,masyarakat,hak,tingkat,pihak,perintah,Pergerakan Nasional
PKB,jalan  amanah  aspirasi  masyarakat                                                 ,masyarakat,tingkat,pihak,perintah,perintah,Pergerakan Nasional
Golkar,masyarakat  perempuan                                                   ,masyarakat,tingkat,pihak,perintah,perintah,Pergerakan Nasional
PSI,layan  masyarakat                                                   ,masyarakat,hak,tingkat,pihak,perintah,Pergerakan Nasional
PPP,sarana  langsung  terima  aspirasi  masyarakat                                                ,masyarakat,tingkat,pihak,perintah,perintah,Pergerakan Nasional
PKPI,kuat  peran  masyarakat  bangun  ekonomi  nasioanal                                               ,masyarakat,hak,tingkat,perintah,perintah,Pergerakan Nasional
PDIP,layan  masyarakat                                                   ,masyarakat,hak,tingkat,pihak,perintah,Pergerakan Nasional
Nasdem,tingkat  sumber  daya  manusia  bantu  masyarakat  kurang  tingkat  buta  huruf                                           ,masyarakat,hak,tingkat,pihak,perintah,Pergerakan Nasional
PAN,juang  aspirasi  masyarakat  dapil  3  jabar  bidang  usaha  tengah  koperasi  baik  fasilitas  dasar  butuh  masyarakat                                      ,masyarakat,hak,tingkat,pihak,perintah,Pergerakan Nasional
Garuda,baik  tingkat  bangun  butuh  butuh  dasar  masyarakat  daerah  pilih                                            ,masyarakat,hak,tingkat,pihak,perintah,Pergerakan Nasional
PBB,anggota  dewan  awal  aspirasi  masyarakat                                                ,masyarakat,hak,tingkat,tingkat,tingkat,Pergerakan Nasional
Hanura,masyarakat  mandiri  sejahtera                                                  ,masyarakat,hak,tingkat,pihak,perintah,Pergerakan Nasional
Demokrat,bela  penting  masyarakat                                                  ,masyarakat,tingkat,pihak,perintah,perintah,Pergerakan Nasional
PPP,isi  contoh  anggota  dpr  dprd  provinsi  dprd  kab  kota                                            ,provinsi,masyarakat,bangun,dprd,fungsi,Peran Anggota Legislatif
PSI,isi  contoh  anggota  dpr  dprd  provinsi  dprd  kab  kota                                            ,provinsi,masyarakat,bangun,dprd,fungsi,Peran Anggota Legislatif
PKB,bawa  aspirasi  masyarakat  bener  riah  aceh  tingkat  provinsi                                             ,provinsi,masyarakat,bangun,dprd,fungsi,Peran Anggota Legislatif
Nasdem,abdi  partai  golkar  oleh  kursi  dpr  r1  dapil  ii  provinsi  aceh                                          ,provinsi,masyarakat,bangun,dprd,fungsi,Peran Anggota Legislatif
Gerindra,abdi  partai  golkar  oleh  kursi  dpr  r1  dapil  ii  provinsi  aceh                                          ,provinsi,masyarakat,bangun,dprd,fungsi,Peran Anggota Legislatif
PAN,isi  contoh  anggota  dpr  dprd  provinsi  dprd  kab  kota                                            ,provinsi,masyarakat,bangun,dprd,fungsi,Peran Anggota Legislatif
Golkar,abdi  partai  golkar  oleh  kursi  dpr  r1  dapil  ii  provinsi  aceh                                          ,provinsi,masyarakat,bangun,dprd,fungsi,Peran Anggota Legislatif
Berkarya,abdi  partai  golkar  oleh  kursi  dpr  r1  dapil  ii  provinsi  aceh                                          ,provinsi,masyarakat,bangun,dprd,fungsi,Peran Anggota Legislatif
PDIP,target  sasar  jabat  anggota  legislatif  provinsi  sumatera  utara  sejahtera  hidup  masyarakat  provinsi  sumatera  utara                                       ,provinsi,masyarakat,bangun,dprd,fungsi,Peran Anggota Legislatif
Garuda,anggota  dprd  provinsi                                                  ,provinsi,masyarakat,bangun,dprd,fungsi,Peran Anggota Legislatif
PKS,anggota  dpr  dprd  provinsi  dprd  kab  kota  hak  wajib  anggota  legislative                                          ,provinsi,masyarakat,dprd,fungsi,fungsi,Peran Anggota Legislatif
Hanura,isi  contoh  anggota  dpr  dprd  provinsi  dprd  kab  kota                                            ,provinsi,masyarakat,bangun,dprd,fungsi,Peran Anggota Legislatif
Demokrat,bantu  aspirasi  masyarakat  kota  denpasar  provinsi  bal                                              ,provinsi,masyarakat,bangun,dprd,fungsi,Peran Anggota Legislatif
PKPI,turun  tingkat  miskin  provinsi  banten                                                ,provinsi,masyarakat,bangun,dprd,fungsi,Peran Anggota Legislatif
PBB,anggota  dprd  provinsi  riau  2019  2024  peran  tingkat  derajat  sehat  masyarakat                                          ,provinsi,masyarakat,bangun,dprd,fungsi,Peran Anggota Legislatif
Golkar,abdi  maju  bangsa  juang  aspirasi  daerah                            ,daerah,masyarakat,perempuan,kaum,ekonomi,Perekonomian Masyarakat
PAN,wakil  rakyat  daerah  sumut  3  benar2  juang  bela  penting  rakyat                        ,daerah,masyarakat,perempuan,kaum,kaum,Perekonomian Masyarakat
PSI,awas  birokrasi  perintah  daerah                              ,daerah,perempuan,kaum,ekonomi,ekonomi,Perekonomian Masyarakat
Hanura,berkonteribusi  daerah  pilih  daerah                              ,daerah,perempuan,kaum,ekonomi,ekonomi,Perekonomian Masyarakat
PDIP,ambil  ambil  putus  bijak  membangut  daerah                            ,daerah,masyarakat,perempuan,kaum,ekonomi,Perekonomian Masyarakat
Berkarya,maju  daerah  klungkung                               ,daerah,perempuan,kaum,ekonomi,ekonomi,Perekonomian Masyarakat
PKB,bangun  daerah  lahir                               ,daerah,perempuan,kaum,ekonomi,ekonomi,Perekonomian Masyarakat
Demokrat,bangun  daerah                                ,daerah,perempuan,kaum,ekonomi,ekonomi,Perekonomian Masyarakat
PPP,bantu  bangun  daerah                               ,daerah,perempuan,ekonomi,ekonomi,ekonomi,Perekonomian Masyarakat
Garuda,muda  guna  maju  bangsa  indonesia  daerah  bidang  didik  pasti  tingkat  sumber   manusia  sdm  daerah                   ,daerah,perempuan,kaum,ekonomi,ekonomi,Perekonomian Masyarakat
PKPI,abdi  bangun  sumbar  daerah  pesisir                             ,daerah,masyarakat,perempuan,kaum,ekonomi,Perekonomian Masyarakat
Gerindra,motivasi  aju  calon  anggota  dpr  aceh  partisipasi  aktif  dorong  ekselarasi  bangun   sejahtera  masyarakat  aceh  fungsi  parlementarian  amanah  atur  undang  undang             ,masyarakat,perempuan,kaum,ekonomi,ekonomi,Perekonomian Masyarakat
PBB,peran  aktif  bangun  masyarakat                              ,masyarakat,perempuan,kaum,ekonomi,ekonomi,Perekonomian Masyarakat
Nasdem,abdi  negara  masyarakat  wakil  baik  sikap  prilaku  ada  anggota  legislatif  kembali   peran  anggota  legislatif                   ,masyarakat,perempuan,kaum,ekonomi,maju,Perekonomian Masyarakat
PKS,jadi  sambung  realisasi  aspirasi  masyarakat  kabupaten  bogor                           ,masyarakat,perempuan,kaum,ekonomi,maju,Perekonomian Masyarakat
Golkar,juang  penting  rakyat  indonesia                              ,rakyat,juang,penting,perempuan,maju,Kesejahteraan Rakyat
Gerindra,abdi  juang  sejahtera  rakyat  aceh                             ,rakyat,juang,penting,perempuan,maju,Kesejahteraan Rakyat
PAN,wakil  rakyat  daerah  sumut  3  benar2  juang  bela  penting  rakyat                        ,rakyat,juang,penting,perempuan,maju,Kesejahteraan Rakyat
PSI,juang  aspirasi  rakyat  capai  indonesia  sejahtera                            ,rakyat,juang,penting,perempuan,maju,Kesejahteraan Rakyat
PKS,khidmat  rakyat                                ,rakyat,juang,perempuan,perempuan,perempuan,Kesejahteraan Rakyat
PPP,wujud  tingkat  ekonomi  rakyat  wujud  adil  ekonomi  masyarakat                          ,rakyat,perempuan,maju,maju,maju,Kesejahteraan Rakyat
PDIP,wujud  rakyat  sejahtera  bijak  perintah                             ,rakyat,penting,perempuan,maju,maju,Kesejahteraan Rakyat
PKPI,rakyat                                 ,rakyat,penting,maju,maju,maju,Kesejahteraan Rakyat
Demokrat,wakil  rakyat  kualitas                               ,rakyat,penting,perempuan,perempuan,perempuan,Kesejahteraan Rakyat
Nasdem,juang  maju  sejahtera  bangsa  indonesia                             ,juang,perempuan,perempuan,perempuan,perempuan,Kesejahteraan Rakyat
Garuda,juang  penting  rakyat                               ,penting,penting,penting,penting,penting,Kesejahteraan Rakyat
Gerindra,motivasi  aju  calon  anggota  dpr  aceh  partisipasi  aktif  dorong  ekselarasi  bangun   sejahtera  masyarakat  aceh  fungsi  parlementarian  amanah  atur  undang  undang             ,masyarakat,anak,juang,kota,kota,Isu Pendidikan
Garuda,mensejahtrakan  masyarakat                                ,masyarakat,anak,juang,kota,kota,Isu Pendidikan
PKB,corong  masyarakat  suara  penting  public  indonesia                            ,masyarakat,juang,didik,didik,didik,Isu Pendidikan
PSI,realisasi  cita  cita  bakti  bangsa  negara  masyarakat  aceh  kontribusi  bangun  aceh   modern  sesuai  syariat                   ,masyarakat,juang,kota,kota,kota,Isu Pendidikan
Golkar,tingkat  kesejahtraan  masyarakat  daya  ekonomi  karakteristik  mental  wujud  indonesia  makmur  sejahtera   nyata                     ,masyarakat,juang,kota,kota,kota,Isu Pendidikan
PPP,sejahtera  masyarakat                                ,masyarakat,anak,juang,didik,kota,Isu Pendidikan
Berkarya,juang  hak  hak  rakyat  sambung  aspirasi  masyarakat                           ,masyarakat,anak,juang,didik,kota,Isu Pendidikan
PBB,peran  aktif  bangun  masyarakat                              ,masyarakat,juang,juang,juang,juang,Isu Pendidikan
Nasdem,abdi  negara  masyarakat  wakil  baik  sikap  prilaku  ada  anggota  legislatif  kembali   peran  anggota  legislatif                   ,masyarakat,juang,didik,didik,didik,Isu Pendidikan
PKS,jadi  sambung  realisasi  aspirasi  masyarakat  kabupaten  bogor                           ,masyarakat,juang,didik,kota,kota,Isu Pendidikan
PAN,juang  masyarakat  dapil  hidup                              ,masyarakat,juang,didik,kota,kota,Isu Pendidikan
Demokrat,motivasi  calon  anggota  legislatif  provinsi  sumatera  utara  juang  aspirasi  masyarakat  provinsi   utara                     ,masyarakat,anak,juang,kota,kota,Isu Pendidikan
PDIP,salur  aspirasi  masyarakat  nusa  tenggara  timur                            ,masyarakat,juang,kota,kota,kota,Isu Pendidikan
Hanura,abdi  masyarakat                                ,masyarakat,anak,juang,didik,kota,Isu Pendidikan
PKPI,abdi  masyarakat                                ,masyarakat,juang,didik,kota,kota,Isu Pendidikan
